{
  "version": 1,
  "placeholder": "placeholder.png",
  "groupOrder": [
    "directors",
    "phd",
    "masters",
    "undergraduate"
  ],
  "alumniGroupOrder": [
    "phd",
    "masters",
    "undergraduate"
  ],
  "groups": {
    "directors": {
      "label": "Lab Directors",
      "intro": "Faculty who lead Design Exploration research, teaching, and outreach.",
      "alumniLabel": "Former Directors"
    },
    "phd": {
      "label": "Ph.D. Students",
      "intro": "Doctoral students leading core research projects.",
      "alumniLabel": "Former Ph.D. Students"
    },
    "masters": {
      "label": "Master's Students",
      "intro": "Master's students working on thesis-driven design research.",
      "alumniLabel": "Former Master's Students"
    },
    "undergraduate": {
      "label": "Undergraduate Students",
      "intro": "Undergraduates contributing to lab projects, tools, and research studies.",
      "alumniLabel": "Former Undergraduate Students"
    }
  },
  "people": [
    {
      "id": "chris-mattson",
      "name": "Chris Mattson",
      "title": "Lab Co-director",
      "group": "directors",
      "status": "current",
      "order": 1,
      "bio": "\"Pure and simple, I love to create things.\" Chris is a professor of mechanical engineering at Brigham Young University and performs research in engineering for global development. The research Chris performs has led to products like the Village Drill and World Cart. Chris has also been the recipient of the Presidential Early Career Award for Scientists and Engineers, as well as the National Science Foundation CAREER award.",
      "photo": "chris-mattson.jpg"
    },
    {
      "id": "john-salmon",
      "name": "John Salmon",
      "title": "Lab Co-director",
      "group": "directors",
      "status": "current",
      "order": 2,
      "bio": "Although not a student, John is a student of design - there is always more to learn and apply. John is an assistant professor of mechanical engineering at Brigham Young University. His research interests include systems engineering, design, and integration, multi-disciplinary optimization, operations research, visual and data analytics, modeling and simulation, multi-agent multi-objective decision making, sports analytics, virtual reality, and uncertainty analysis. He thinks innovation and creativity are the highest forms of intelligence and he believes design is at the core of making the world and oneself better.",
      "photo": "john-salmon.jpg"
    },
    {
      "id": "tevin-dickerson",
      "name": "Tevin Dickerson",
      "title": "Former Ph.D. Student",
      "group": "phd",
      "status": "alumni",
      "order": 1,
      "bio": "Tevin is a PhD candidate in mechanical engineering. He's from Cottonwood Heights, UT and is emphasizing in aerospace. On the team, he has worked on the airship project and traveling salesman. He likes to waterski and rock climb as well. His thoughts on engineering are, ?to make the impossible, possible?.",
      "photo": "tevin-dickerson.jpg",
      "links": {}
    },
    {
      "id": "samuel-mckinnon",
      "name": "Samuel McKinnon",
      "title": "Ph.D. Candidate",
      "group": "phd",
      "status": "current",
      "order": 2,
      "bio": "Samuel is a PhD candidate researching graph based social impact diffusion - a modeling method that can estimate the social impacts that engineered products or systems have on society. He is a past editor of the BYU Design Review and has worked on engineering projects in Peru, Ecuador, Bolivia, and Brazil. Upon completing his PhD, he hopes to be a mechanical engineering professor and continue researching engineering for sustainable development.",
      "photo": "samuel-mckinnon.jpg"
    },
    {
      "id": "scott-rice",
      "name": "Scott Rice",
      "title": "Ph.D. Candidate",
      "group": "phd",
      "status": "current",
      "order": 3,
      "bio": "Scott Rice is a PhD student in mechanical engineering and ten-year veteran of the U.S Army where he served as an Engineer Officer. He is currently researching methods to help people make the best decisions possible early in the design process. Scott believes strongly in helping others turn their new ideas into useful products that function well. \"Many people have great ideas, but few know how to make them work well in reality. I want to help them achieve that.\"",
      "photo": "scott-rice.png"
    },
    {
      "id": "jacob-broadbent",
      "name": "Jacob Broadbent",
      "title": "Master's Student",
      "group": "masters",
      "status": "current",
      "order": 1,
      "bio": "Jacob is a joint MBA/MS in Mechanical Engineering student developing methods to determine what a product offers people based on its specifications. Before returning to grad school, he worked as a project manager at Delta Air Lines, a product development engineer in consumer products, and a manufacturing engineer at Merit Medical. He loves using this experience to help support and ground the lab's work. He did his MBA internship with PwC Advisory's Physical Product Development & Manufacturing practice and will return full time as a Senior Associate after graduation. As a consultant, he plans to introduce and implement the lab's methods across industries.",
      "links": {
        "email": "jacobbroadbent34@gmail.com",
        "linkedin": "https://www.linkedin.com/in/jacobbroadbent/"
      },
      "photo": "jacob-broadbent.jpg"
    },
    {
      "id": "tyson-humphrey",
      "name": "Tyson Humphrey",
      "title": "Master's Student",
      "group": "masters",
      "status": "alumni",
      "order": 2,
      "bio": "Tyson is currently pursuing a Master's degree in Mechanical Engineering, focusing primarily on studying product architecture methods. He completed his undergraduate studies in Mechanical Engineering at BYU. His career goal is to secure a product design/development position focused on creating direct-to-consumer products. Tyson finds solace in the support of his wife, who serves as his biggest advocate. In his free time, Tyson can be found exploring the great outdoors hiking, engaging in intramural football matches, or channeling his creativity through 3D-printing and painting costume pieces. With a diverse range of interests and a dedication to excellence, Tyson is poised to make a significant impact in the field of mechanical engineering.",
      "photo": "tyson-humphrey.png"
    },
    {
      "id": "thomas-geilman",
      "name": "Thomas Geilman",
      "title": "Master's Student",
      "group": "masters",
      "status": "current",
      "order": 1,
      "bio": "Thomas is an undergraduate student in mechanical engineering. He loves learning, which has led to interests and hobbies including 3D printing, reading, and welding as he constantly tries learning new skills. He helped with the cassava peeler project and is excited to continue his work in the lab. He says, ?I love how engineering design combines empathy and knowledge to help people around the world. One of my main goals in life is to use my skills to help others, and engineering helps me achieve this goal?.",
      "photo": "thomas-geilman.jpg"
    },
    {
      "id": "benjamin-sannar",
      "name": "Benjamin Sannar",
      "title": "Ph.D. Student",
      "group": "phd",
      "status": "current",
      "order": 2,
      "bio": "Benjamin Sannar is a PhD. student from Northern California. He grew up inspired by a heritage of ingenuity and surrounded by the processes that put fruit and vegetables onto tables around the world. His research interests include product development, product architecture, and early-stage design tradeoffs. His current projects center on innovation within high-risk low-resource scenarios with applications for global development, and defense.\nBen is a Crocker Innovation Fellowship alumnus of the cohort of 2024.",
      "photo": "benjamin-sannar.jpg",
      "links": {
        "email": "bsannar@byu.edu",
        "website": "https://www.et.byu.edu/~bsannar/"
      }
    },
    {
      "id": "henry-wooley",
      "name": "Henry Wooley",
      "title": "Undergraduate Student",
      "group": "undergraduate",
      "status": "alumni",
      "order": 3,
      "bio": "Born and raised in Central California, Henry has always loved bringing ideas to life. His passion began in elementary school, building a go-cart from bike tires and two-by-fours. Now, he applies that hands-on creativity to solving real-world problems. Henry is currently working as a student engineer where he enjoys creating new tools and processes to improve the manufacturing and quality of diamond bearings. As a student, he is interested in engineering design, interdisciplinary collaboration, aerospace, and fluid mechanics. Outside the classroom, he enjoys fly-fishing, hunting, skiing, and woodworking."
    },
    {
      "id": "joshua-cook",
      "name": "Joshua Cook",
      "title": "Master's Student",
      "group": "masters",
      "status": "current",
      "order": 4,
      "bio": "Joshua is a master's student researching aggregation strategies within social impact transfer theory. His interest in nuclear engineering led him to serve as an NNSA Graduate Fellow at Lawrence Livermore National Laboratory, where he worked at the intersection of precision manufacturing, advanced 3D printing, and experimental validation. Joshua plans on returning to Lawrence Livermore National Laboratory as a mechanical design engineer after completing his master's research. Outside of engineering, Joshua enjoys writing poetry, mountain biking, and spending time with his wife and cat.",
      "links": {
        "linkedin": "https://www.linkedin.com/in/joshuacookwright/"
      }
    },
    {
      "id": "isaac-detiege",
      "name": "Isaac Detiege",
      "title": "Master's Student",
      "group": "masters",
      "status": "current",
      "order": 5,
      "bio": ""
    },
    {
      "id": "abigail-little",